{
  "$schema": "../../../tools/schemas/fable2-gpu-divergence-matrix-v1.schema.json",
  "schema_version": "1.0.0",
  "corpus": "Fable II Native Renderer G1.5C",
  "generated_on": "2026-09-01",
  "pins": {
    "fable_repository": {
      "path": "C:\\Dev\\Fable2Recomp",
      "branch": "fable2-native-renderer-g1.5-reference",
      "commit": "790cf26bc089d94b2102e3df11386bbf2e5ed692",
      "tree": "35136b97b036ecf981b7e23ebd946c50f648b504"
    },
    "rexglue_repository": {
      "path": "C:\\Dev\\rexglue-sdk-v0.10",
      "branch": "fable2-v0.10-migration",
      "commit": "956c6a8b5da4c54b9899a2593e9c67c26de30194",
      "tree": "b78b06b8ac650467372236a3a262864e069a9382"
    },
    "canary_repository": {
      "path": "C:\\Dev\\Fable2NativeRendererResearch\\xenia-canary",
      "branch": "canary_experimental",
      "commit": "3a44f20c7bc66db1da583e8a6f0ab740e31908e9",
      "tree": "c343b0a5796590fadc3b78c993bfada51e7e9148"
    },
    "active_gpu_artifact": {
      "filename": "rexgpu-xenos.dll",
      "size": 2770944,
      "sha256": "8232051BED6E5CE99CF37B2EF581C824F58875C140A4D3C75DE14E8A5DF4AA99",
      "backend": "D3D12 only"
    }
  },
  "records": [
    {
      "record_id": "BCK-001",
      "subsystem": "Backend boundaries",
      "behaviour": "Backend set present in the exact deployed ReXGlue GPU artifact versus pinned Canary source",
      "source_confidence": "CONFIRMED",
      "rexglue": {
        "repository": "rexglue",
        "commit": "956c6a8b5da4c54b9899a2593e9c67c26de30194",
        "paths": [
          {
            "path": "src/graphics/CMakeLists.txt",
            "symbols": [
              "REXGLUE_USE_D3D12",
              "REXGLUE_USE_VULKAN"
            ]
          },
          {
            "path": "src/graphics/plugin_main.cpp",
            "symbols": [
              "D3D12GraphicsSystem",
              "VulkanGraphicsSystem"
            ]
          }
        ],
        "summary": "The pinned source contains D3D12 and Vulkan, but the verified rexgpu-xenos.dll was built with D3D12 enabled and Vulkan disabled."
      },
      "canary": {
        "repository": "canary",
        "commit": "3a44f20c7bc66db1da583e8a6f0ab740e31908e9",
        "paths": [
          {
            "path": "src/xenia/app/xenia_main.cc",
            "symbols": [
              "EmulatorApp::CreateGraphicsSystem",
              "D3D12GraphicsSystem",
              "VulkanGraphicsSystem",
              "NullGraphicsSystem"
            ]
          }
        ],
        "summary": "Pinned Canary source exposes D3D12, Vulkan and null factories, with platform and configuration selection."
      },
      "direction": "SEMANTICALLY DIFFERENT",
      "material_divergences": [
        "The exact Fable deployment can execute only the ReXGlue D3D12 backend; Canary source comparison spans additional backends that are not in that artifact."
      ],
      "classification": {
        "primary": "HOST BACKEND/API ADAPTATION",
        "secondary": [
          "HOST CAPABILITY OR CONFIGURATION PATH",
          "REXGLUE-SPECIFIC INTEGRATION"
        ]
      },
      "historical_provenance": {
        "history_ids": [
          "REX-c22a33e2"
        ],
        "summary": "The plugin extraction explains deployment form; exact backend inclusion is confirmed by G1.5A CMake-cache and binary evidence rather than commit intent."
      },
      "rationale_confidence": "INFERRED RATIONALE",
      "preliminary_fable": {
        "relevance": "CONFIRMED RELEVANT",
        "evidence": [
          "The staged, package and SDK-build DLL hashes match, and accepted logs identify D3D12 initialization."
        ],
        "evidence_required": [
          "No evidence is needed for active backend identity; behavior-level relevance belongs to individual rows."
        ]
      },
      "preliminary_renderer_implication": "Active-artifact claims must be restricted to D3D12; Vulkan differences are design reference only in this phase.",
      "open_questions": []
    },
    {
      "record_id": "BCK-002",
      "subsystem": "Backend boundaries",
      "behaviour": "Shared GPU architecture and D3D12/Vulkan/null capability boundaries",
      "source_confidence": "CONFIRMED",
      "rexglue": {
        "repository": "rexglue",
        "commit": "956c6a8b5da4c54b9899a2593e9c67c26de30194",
        "paths": [
          {
            "path": "src/graphics/d3d12/graphics_system.cpp",
            "symbols": [
              "D3D12GraphicsSystem::CreateCommandProcessor"
            ]
          },
          {
            "path": "src/graphics/vulkan/graphics_system.cpp",
            "symbols": [
              "VulkanGraphicsSystem::CreateCommandProcessor"
            ]
          }
        ],
        "summary": "ReXGlue shares GPU modeling above D3D12/Vulkan backends and contains MoltenVK adaptations; it has no Canary null backend and current Fable packaging excludes Vulkan."
      },
      "canary": {
        "repository": "canary",
        "commit": "3a44f20c7bc66db1da583e8a6f0ab740e31908e9",
        "paths": [
          {
            "path": "src/xenia/gpu/d3d12/d3d12_graphics_system.cc",
            "symbols": [
              "D3D12GraphicsSystem::CreateCommandProcessor"
            ]
          },
          {
            "path": "src/xenia/gpu/vulkan/vulkan_graphics_system.cc",
            "symbols": [
              "VulkanGraphicsSystem::CreateCommandProcessor"
            ]
          },
          {
            "path": "src/xenia/gpu/null/null_graphics_system.cc",
            "symbols": [
              "NullGraphicsSystem::CreateCommandProcessor"
            ]
          }
        ],
        "summary": "Canary retains shared GPU behavior above D3D12/Vulkan and a null backend, with provider capability branches and current per-backend implementations."
      },
      "direction": "SEMANTICALLY DIFFERENT",
      "material_divergences": [
        "Backend inventory, host capability surfaces and MoltenVK-specific adaptation differ; these are not a ranking of implementation correctness."
      ],
      "classification": {
        "primary": "HOST BACKEND/API ADAPTATION",
        "secondary": [
          "HOST CAPABILITY OR CONFIGURATION PATH",
          "ARCHITECTURE REFACTOR"
        ]
      },
      "historical_provenance": {
        "history_ids": [
          "REX-5f5d7f6f"
        ],
        "summary": "ReXGlue's direct commit records its MoltenVK adaptations and runtime-discovery packaging."
      },
      "rationale_confidence": "CONFIRMED RATIONALE",
      "preliminary_fable": {
        "relevance": "NOT APPLICABLE TO FABLE II",
        "evidence": [
          "Vulkan and null are excluded from the exact active GPU artifact."
        ],
        "evidence_required": [
          "None for the current artifact; future backend work would require a new scope and pin."
        ]
      },
      "preliminary_renderer_implication": "Backend-neutral guest behavior should be isolated from host API and capability choices; no backend expansion is authorized here.",
      "open_questions": []
    },
    {
      "record_id": "BND-001",
      "subsystem": "Plugin/runtime boundary",
      "behaviour": "GPU construction, runtime ABI, ownership and dispatch",
      "source_confidence": "CONFIRMED",
      "rexglue": {
        "repository": "rexglue",
        "commit": "956c6a8b5da4c54b9899a2593e9c67c26de30194",
        "paths": [
          {
            "path": "src/ui/rex_app.cpp",
            "symbols": [
              "ReXApp::SetupPresentation"
            ]
          },
          {
            "path": "src/system/gpu_plugin_loader.cpp",
            "symbols": [
              "LoadGpuPlugin"
            ]
          },
          {
            "path": "src/graphics/plugin_main.cpp",
            "symbols": [
              "rex_gpu_create"
            ]
          }
        ],
        "summary": "ReXApp loads rexgpu-xenos at runtime, creates an IGraphicsSystem through the plugin ABI, and retains runtime-side ownership and shutdown control."
      },
      "canary": {
        "repository": "canary",
        "commit": "3a44f20c7bc66db1da583e8a6f0ab740e31908e9",
        "paths": [
          {
            "path": "src/xenia/app/xenia_main.cc",
            "symbols": [
              "EmulatorApp::CreateGraphicsSystem"
            ]
          },
          {
            "path": "src/xenia/emulator.cc",
            "symbols": [
              "Emulator::Setup"
            ]
          }
        ],
        "summary": "Canary selects and owns an in-process D3D12, Vulkan or null GraphicsSystem factory as part of Emulator setup; it has no ReXGlue plugin ABI."
      },
      "direction": "REXGLUE-ONLY",
      "material_divergences": [
        "ReXGlue introduces a runtime-loaded GPU plugin ABI and IGraphicsSystem integration boundary absent from Canary."
      ],
      "classification": {
        "primary": "REXGLUE-SPECIFIC INTEGRATION",
        "secondary": [
          "ARCHITECTURE REFACTOR"
        ]
      },
      "historical_provenance": {
        "history_ids": [
          "REX-55a836fb",
          "REX-c22a33e2"
        ],
        "summary": "Direct ReXGlue commits route GPU access through IGraphicsSystem and extract the Xenos implementation into a runtime-loaded plugin."
      },
      "rationale_confidence": "CONFIRMED RATIONALE",
      "preliminary_fable": {
        "relevance": "CONFIRMED RELEVANT",
        "evidence": [
          "Accepted G1.5A runtime evidence identifies the loaded rexgpu-xenos.dll and D3D12 initialization path."
        ],
        "evidence_required": [
          "No additional evidence is needed to establish boundary use; defect relevance remains a separate G1.5D question."
        ]
      },
      "preliminary_renderer_implication": "Any renderer must implement the ReXGlue ABI and lifecycle contract even if guest-GPU semantics are derived elsewhere.",
      "open_questions": [
        "Which ABI surface is the minimum stable native-renderer contract?"
      ]